{
  "bundle": {
    "artifact_digest": "sha256:aaaaaaaaaaaaaaaaaaaaaaaaaaaaaaaaaaaaaaaaaaaaaaaaaaaaaaaaaaaaaaaa",
    "manifest_digest": "sha256:bbbbbbbbbbbbbbbbbbbbbbbbbbbbbbbbbbbbbbbbbbbbbbbbbbbbbbbbbbbbbbbb",
    "release_sequence": 1,
    "version": "1.0.0"
  },
  "created_at": "2026-07-11T00:00:00Z",
  "gates": {
    "max_failure_rate": 0.02,
    "required_check_failure_tolerance": 0,
    "security_failure_tolerance": 0
  },
  "mutation": {
    "auto_merge": false,
    "mode": "pull-request"
  },
  "plan_digest": "sha256:ac4814bf4f176f21380c6e18563cb4510d63e387d6a93799897710c182effb52",
  "rollout_id": "rollout_01J00000000000000000000000",
  "schema_version": 1,
  "target_count": 1,
  "target_set_digest": "sha256:4bb6ebf0c8849935f2aa9bebcce2126d5fa94686dedbf1325172661c1586083e",
  "waves": [
    {
      "id": "canary",
      "ordinal": 0,
      "repository_ids": [
        "repo_01J00000000000000000000001"
      ],
      "status": "pending"
    }
  ]
}
